{
  "$schema": "https://json-schema.org/draft/2020-12/schema",
  "$id": "https://arcanomy.dev/schemas/blog.schema.json",
  "title": "BlogBundle",
  "type": "object",
  "additionalProperties": false,
  "required": ["schema_version", "blog_identifier", "slug", "title", "published_date", "sections"],
  "properties": {
    "schema_version": { "type": "string", "const": "1.0" },
    "blog_identifier": { "type": "string" },
    "slug": { "type": "string" },
    "title": { "type": "string" },
    "published_date": { "type": "string", "format": "date" },
    "source": {
      "type": "object",
      "additionalProperties": false,
      "required": ["type", "path"],
      "properties": {
        "type": { "type": "string", "enum": ["mdx_cdn", "local_file"] },
        "path": { "type": "string" }
      }
    },
    "sections": {
      "type": "array",
      "minItems": 1,
      "items": {
        "type": "object",
        "additionalProperties": false,
        "required": ["heading", "paragraphs"],
        "properties": {
          "heading": { "type": "string" },
          "paragraphs": {
            "type": "array",
            "minItems": 1,
            "items": {
              "type": "object",
              "additionalProperties": false,
              "required": ["id", "text"],
              "properties": {
                "id": { "type": "string", "pattern": "^p_\\d{3}$" },
                "text": { "type": "string", "minLength": 1 },
                "source_offset": {
                  "type": ["object", "null"],
                  "additionalProperties": false,
                  "required": ["start", "end"],
                  "properties": {
                    "start": { "type": "integer", "minimum": 0 },
                    "end": { "type": "integer", "minimum": 0 }
                  }
                }
              }
            }
          }
        }
      }
    },
    "tables": { "type": "array", "items": { "type": "object" } },
    "figures": { "type": "array", "items": { "type": "object" } }
  }
}

